id,name,benefits,policies,job_description
1,Health Insurance,Contoso Electronics offers a comprehensive health insurance plan, including medical, dental, and vision coverage.,All employees must enroll within 30 days of their start date.,N/A
2,Vacation Policy,Employees receive 15 days of paid vacation per year, which increases to 20 days after 5 years of service.,Vacation requests must be submitted at least two weeks in advance and are subject to approval by a manager.,N/A
3,Software Engineer, N/A, N/A,Software Engineers at Contoso Electronics are responsible for designing, developing, and maintaining software solutions. Key skills include programming languages such as C#, Java, and Python, as well as experience with databases and cloud technologies.
4,Data Analyst, N/A, N/A,Data Analysts at Contoso Electronics are responsible for analyzing and interpreting data to provide insights and recommendations to the company. Key skills include knowledge of SQL, data visualization tools, and statistical analysis techniques.
5,401(k) Retirement Plan,Contoso Electronics offers a 401(k) retirement plan with a company match of up to 4% of the employee's salary.,Employees are eligible to enroll after 90 days of employment.,N/A
6,Life Insurance,Contoso Electronics provides life insurance coverage equal to 1.5 times the employee's annual salary.,Coverage begins on the employee's start date.,N/A
7,Product Manager, N/A, N/A,Product Managers at Contoso Electronics are responsible for guiding the development and launch of new products and features. Key skills include project management, market research, and cross-functional team collaboration.
8,Technical Support Specialist, N/A, N/A,Technical Support Specialists at Contoso Electronics provide technical assistance to customers and employees, troubleshoot issues, and maintain documentation of resolutions. Key skills include customer service, problem-solving, and knowledge of the company's products.
9,Remote Work Policy,Contoso Electronics supports remote work arrangements for certain roles, subject to manager approval.,Employees must maintain a dedicated workspace and adhere to company security policies.,N/A
10,Performance Review Process,Contoso Electronics conducts annual performance reviews to assess employee performance, provide feedback, and set goals for the upcoming year.,Employees are expected to participate in self-assessment and goal-setting.,N/A
11,Marketing Manager, N/A, N/A,Marketing Managers at Contoso Electronics are responsible for creating and executing marketing strategies to promote the company's products and services. Key skills include market research, advertising, and public relations.
12,Human Resources Specialist, N/A, N/A,Human Resources Specialists at Contoso Electronics manage various HR functions, such as recruiting, onboarding, benefits administration, and employee relations. Key skills include knowledge of HR best practices, strong communication, and organization.
13,Workplace Safety Policy,Contoso Electronics is committed to maintaining a safe work environment and adheres to all applicable safety regulations.,Employees must report any safety hazards or concerns to their supervisor.,N/A
14,Expense Reimbursement Policy,Contoso Electronics reimburses employees for approved work-related expenses, such as travel and office supplies.,Employees must submit receipts and an expense report within 30 days of incurring the expense.,N/A
15,Project Manager, N/A, N/A,Project Managers at Contoso Electronics are responsible for planning, executing, and closing projects. Key skills include project management, risk assessment, and team leadership.
16,Quality Assurance Analyst, N/A, N/A,Quality Assurance Analysts at Contoso Electronics test and evaluate products to ensure they meet quality standards. Key skills include attention to detail
17,Employee Assistance Program,Contoso Electronics offers an EAP to provide confidential counseling and support services for employees and their family members.,All employees are eligible to use the EAP services at no cost.,N/A
18,Training and Development Program,Contoso Electronics provides opportunities for employees to develop their skills and knowledge through training programs, conferences, and workshops.,Employees are encouraged to discuss their career goals with their manager and identify relevant training opportunities.,N/A
19,Financial Analyst, N/A, N/A,Financial Analysts at Contoso Electronics are responsible for analyzing financial data and creating reports to support decision-making. Key skills include knowledge of accounting principles, financial modeling, and data analysis tools.
20,Diversity, Equity, and Inclusion Policy,Contoso Electronics is committed to promoting a diverse, equitable, and inclusive workplace and provides training and resources to support this effort.,Employees are expected to uphold the company's DEI values and participate in related initiatives.,N/A
21,IT Security Policy,Contoso Electronics has strict security policies to protect company data and systems. Employees must follow security protocols and report any suspicious activity.,N/A
22,Sales Representative, N/A, N/A,Sales Representatives at Contoso Electronics are responsible for generating revenue by selling the company's products and services to customers. Key skills include sales experience, communication, and relationship-building.
23,Employee Referral Program,Contoso Electronics offers a referral bonus to employees who refer qualified candidates for open positions.,The referred candidate must be hired and complete a probationary period to be eligible for the bonus.,N/A
24,Graphic Designer, N/A, N/A,Graphic Designers at Contoso Electronics are responsible for creating visual designs for marketing materials, websites, and product interfaces. Key skills include proficiency in design software and knowledge of design principles.
25,Employee Wellness Program,Contoso Electronics offers a wellness program to promote healthy lifestyle choices and provide resources for physical and mental well-being.,All employees are eligible to participate in wellness activities and events.,N/A
26,Supply Chain Manager, N/A, N/A,Supply Chain Managers at Contoso Electronics are responsible for managing the flow of products and materials from suppliers to customers. Key skills include logistics, inventory management, and vendor relationships.
27,Maternity/Paternity Leave Policy,Contoso Electronics provides paid leave for new parents, including maternity, paternity, and adoption leave.,Employees must meet certain eligibility criteria and provide notice and documentation in advance of the leave.,N/A
28,Technical Writer, N/A, N/A,Technical Writers at Contoso Electronics create documentation, such as user manuals and technical specifications, for the company's products and services. Key skills include writing, editing, and technical knowledge.
29,Employee Recognition Program,Contoso Electronics recognizes employees who demonstrate exceptional performance or contribute to the company's success through awards, bonuses, and public recognition.,N/A,N/A
30,Accountant, N/A, N/A,Accountants at Contoso Electronics are responsible for managing financial transactions and ensuring accurate record-keeping. Key skills include knowledge of accounting principles and software, attention to detail, and problem-solving.
31,Code of Conduct Policy,Contoso Electronics has a code of conduct policy that outlines the company's expectations for ethical behavior and provides guidelines for appropriate conduct in the workplace.,All employees are expected to read and comply with the policy.,N/A
32,IT Support Engineer, N/A, N/A,IT Support Engineers at Contoso Electronics provide technical support for the company's hardware and software systems. Key skills include troubleshooting, customer service, and knowledge of IT infrastructure.
33,Employee Privacy Policy,Contoso Electronics has a policy to protect employee privacy and limit access to confidential information.,Employees must adhere to the policy and report any violations.,N/A
34,Operations Manager, N/A, N/A,Operations Managers at Contoso Electronics oversee the day-to-day operations of the company, including production, supply chain, and customer service. Key skills include project management, problem-solving, and team leadership.
35,Professional Development Policy,Contoso Electronics supports employees' professional development by providing resources and opportunities for learning and growth.,Employees are encouraged to discuss their career goals with their manager and identify relevant development opportunities.,N/A
36,Content Strategist, N/A, N/A,Content Strategists at Contoso Electronics develop and implement content strategies for the company's marketing and communication efforts. Key skills include writing, editing, and knowledge of digital marketing trends.